{
  "product": "Example Product",
  "designSystem": "designstack",
  "repoPath": "~/projects/myproduct-frontend",
  "storybookUrl": "http://localhost:6006",
  "liveUrl": "https://app.example.com/dashboard",
  "chrome": {
    "topbar": ".topbar",
    "sidebar": "nav.sidebar",
    "activeNav": "Home",
    "contentSlot": ".main-content"
  },
  "vocabulary": ["item", "record", "run"]
}
